{
  "categories": [
    "profiles.keyPlayersHistorical"
  ],
  "downloadTier": "player-context",
  "fileCount": 154,
  "fileDefaults": {
    "category": "profiles.keyPlayersHistorical",
    "downloadTier": "player-context",
    "required": false,
    "updatedAt": "2026-05-27T00:00:00.000Z"
  },
  "files": [
    {
      "path": "data/profiles/key-players/historical/tahiti/alvin-tehau.json",
      "recordCount": 1,
      "sha256": "0362208e4e145415c37bcb8efd333cdf6b528d386b6fb59eb8ddeeaca5576c66",
      "sizeBytes": 3024
    },
    {
      "path": "data/profiles/key-players/historical/tahiti/axel-temataua.json",
      "recordCount": 1,
      "sha256": "ec2649d15029c7a0335dbaaeb41ae5396f3e12be59adfe0132b3fca1d3939a71",
      "sizeBytes": 1831
    },
    {
      "path": "data/profiles/key-players/historical/tahiti/erroll-bennett.json",
      "recordCount": 1,
      "sha256": "de136c7828dd44d56df93b164357ddca88e680d9e9f5cd3be99b1c2768b51b8f",
      "sizeBytes": 2231
    },
    {
      "path": "data/profiles/key-players/historical/tahiti/felix-tagawa.json",
      "recordCount": 1,
      "sha256": "732e3d2d8796c318ca0c23e9131579515a5789b7a2df84495a9a3b9f3b4e085a",
      "sizeBytes": 2848
    },
    {
      "path": "data/profiles/key-players/historical/tahiti/gerald-quennet.json",
      "recordCount": 1,
      "sha256": "9d242cdda370d0673fb6581613ed137fd1fde6b4d2349d890d1a8c16b35ca330",
      "sizeBytes": 1711
    },
    {
      "path": "data/profiles/key-players/historical/tahiti/harold-amaru.json",
      "recordCount": 1,
      "sha256": "5d16502dfd22b668e8bc4a5a33e162760d197ae57773b41df0e734908c6d2fb8",
      "sizeBytes": 1891
    },
    {
      "path": "data/profiles/key-players/historical/tahiti/index.json",
      "recordCount": 1,
      "sha256": "4987ec1131044ac94c2b1057329b57d1184956ee8dd789d76ed935ab0c87291d",
      "sizeBytes": 2564
    },
    {
      "path": "data/profiles/key-players/historical/tahiti/jean-loup-rousseau.json",
      "recordCount": 1,
      "sha256": "4ab18870dcaa55cc9f628538144b36e6e8ca295e0c0e4002648e02bea474d239",
      "sizeBytes": 2802
    },
    {
      "path": "data/profiles/key-players/historical/tahiti/jonathan-tehau.json",
      "recordCount": 1,
      "sha256": "9bb525f3b72989a01a89487ac7a0f0c186cafbc972270bb40490fef719388e66",
      "sizeBytes": 2424
    },
    {
      "path": "data/profiles/key-players/historical/tahiti/lorenzo-tehau.json",
      "recordCount": 1,
      "sha256": "bb137cb87c5713f08d12a61df52f580528d09b2328676af3e4e988effa287b07",
      "sizeBytes": 2472
    },
    {
      "path": "data/profiles/key-players/historical/tahiti/na.json",
      "recordCount": 1,
      "sha256": "fb14abc421a0ed6ef68872c7522bc850ae41397e68e928b27a2c977f140e7630",
      "sizeBytes": 4907
    },
    {
      "path": "data/profiles/key-players/historical/tahiti/naea-bennett.json",
      "recordCount": 1,
      "sha256": "43bed886e88092c1f6bf9428a79b05d064ff2e888ad939271063ad1e94389659",
      "sizeBytes": 2074
    },
    {
      "path": "data/profiles/key-players/historical/tahiti/teaonui-tehau.json",
      "recordCount": 1,
      "sha256": "715708ad9004b9b7640a76e6f0a3e2d38397833143e8d4800bd86adc68963df2",
      "sizeBytes": 4043
    },
    {
      "path": "data/profiles/key-players/historical/taiwan/ange-kouam.json",
      "recordCount": 1,
      "sha256": "d46e7fd6e34b440bd4992968718d8ae0681cd6a1b1b4b4b4991595620d0ef01d",
      "sizeBytes": 806
    },
    {
      "path": "data/profiles/key-players/historical/taiwan/chang-han.json",
      "recordCount": 1,
      "sha256": "dcbaad940ab0366de2c2c2061634c0fdbc4ffaca645e7ca3d2669b2fe8ad282d",
      "sizeBytes": 1299
    },
    {
      "path": "data/profiles/key-players/historical/taiwan/chang-kuo-chi.json",
      "recordCount": 1,
      "sha256": "3689cc03c1d1627c8eaecb44c9a28c411764ee9d5b36d7936b7fc162538784eb",
      "sizeBytes": 1043
    },
    {
      "path": "data/profiles/key-players/historical/taiwan/chang-wu-yeh.json",
      "recordCount": 1,
      "sha256": "859fadf093fe420b5e71d7e99cbaa8a6cad5d5efa5446617166b2e4940a07c4d",
      "sizeBytes": 1333
    },
    {
      "path": "data/profiles/key-players/historical/taiwan/chen-jui-te.json",
      "recordCount": 1,
      "sha256": "98599c2ed95a6c607037f73a9c669d79587a5b94e170704daff5b9f6388ab113",
      "sizeBytes": 1269
    },
    {
      "path": "data/profiles/key-players/historical/taiwan/chen-po-liang.json",
      "recordCount": 1,
      "sha256": "31d21d7553be0845d378512e41f099c63f1be8a657cfeb537bc858aef55fa1f0",
      "sizeBytes": 1821
    },
    {
      "path": "data/profiles/key-players/historical/taiwan/duh-deng-sheng.json",
      "recordCount": 1,
      "sha256": "81b48163fe93130a161ece400bfdf52e759ee5b7f6160cbd41f4801ea5a0d33b",
      "sizeBytes": 1057
    },
    {
      "path": "data/profiles/key-players/historical/taiwan/huang-wei-yi.json",
      "recordCount": 1,
      "sha256": "453a2cf776e3fd1183fdde5cf9c672763f8e5f692575a38239d41291d11dd992",
      "sizeBytes": 1815
    },
    {
      "path": "data/profiles/key-players/historical/taiwan/index.json",
      "recordCount": 1,
      "sha256": "daee7cfa3e075860c566ba4340507ce1ed198c08a1adf9da39792c27a9e25ee9",
      "sizeBytes": 2543
    },
    {
      "path": "data/profiles/key-players/historical/taiwan/wen-chih-hao.json",
      "recordCount": 1,
      "sha256": "ac2c949e997f2bada606d6b1995f265be6209883f7130a06f5b2b5fe158411d7",
      "sizeBytes": 1650
    },
    {
      "path": "data/profiles/key-players/historical/taiwan/wu-chun-ching.json",
      "recordCount": 1,
      "sha256": "dddf9b346bba42cbef404c775fbbca5c1802c351849df05fb88974fc8fdbf6ba",
      "sizeBytes": 1947
    },
    {
      "path": "data/profiles/key-players/historical/taiwan/wu-yen-shu.json",
      "recordCount": 1,
      "sha256": "27c540319629889892e1f25e80776d384f1fb91ad61919d5a4f81c812e059d90",
      "sizeBytes": 1555
    },
    {
      "path": "data/profiles/key-players/historical/taiwan/yu-yao-hsing.json",
      "recordCount": 1,
      "sha256": "c572cf35fec56198752794bd444d0fa2816de44c18a7728324b8372f6b6eea94",
      "sizeBytes": 1883
    },
    {
      "path": "data/profiles/key-players/historical/tajikistan/akhtam-nazarov.json",
      "recordCount": 1,
      "sha256": "536806796cc7eea57b8d6982790b06ae2cad6a67860bfaee82679d9c9d38c61f",
      "sizeBytes": 1894
    },
    {
      "path": "data/profiles/key-players/historical/tajikistan/akmal-kholmatov.json",
      "recordCount": 1,
      "sha256": "0cac1acfc32e3bf7cd918a632bd25738a7edd14731e70dc63b581f1865d3c49d",
      "sizeBytes": 1708
    },
    {
      "path": "data/profiles/key-players/historical/tajikistan/alier-ashurmamadov.json",
      "recordCount": 1,
      "sha256": "bfe01acaf713ccee46a768b62d430beb8e51631c5e0a62a709705d8096f812fa",
      "sizeBytes": 1857
    },
    {
      "path": "data/profiles/key-players/historical/tajikistan/alisher-dzhalilov.json",
      "recordCount": 1,
      "sha256": "4fe1406141003de216a7b9da948b9983af226837ba547bcb16a50294461eb43d",
      "sizeBytes": 1856
    },
    {
      "path": "data/profiles/key-players/historical/tajikistan/arsen-avakov.json",
      "recordCount": 1,
      "sha256": "0b3fa9a81b56f979768974da54ba8e1bede2dd1b13514b628b69e4deb7504361",
      "sizeBytes": 2179
    },
    {
      "path": "data/profiles/key-players/historical/tajikistan/index.json",
      "recordCount": 1,
      "sha256": "d982d10c434af605e5c29198c13db589ccf29a8c08892c49f2d64bad2c351878",
      "sizeBytes": 2754
    },
    {
      "path": "data/profiles/key-players/historical/tajikistan/manuchekhr-dzhalilov.json",
      "recordCount": 1,
      "sha256": "c40d197dcae9c873bcc6b6e8f991092aa68477d559a3554b0405925f70d458d7",
      "sizeBytes": 4079
    },
    {
      "path": "data/profiles/key-players/historical/tajikistan/numondzhon-khakimov.json",
      "recordCount": 1,
      "sha256": "f9450771da6d3e7ffd992e67516724b840b6841373462b2390890de74221f0b2",
      "sizeBytes": 1897
    },
    {
      "path": "data/profiles/key-players/historical/tajikistan/rustam-khojaev.json",
      "recordCount": 1,
      "sha256": "884b903267891952ef6489acd35276812ff4683c09aef9bc190a0eb8c94189c9",
      "sizeBytes": 1822
    },
    {
      "path": "data/profiles/key-players/historical/tajikistan/shahrom-samiev.json",
      "recordCount": 1,
      "sha256": "d9478528cdc7381c1d96c9c2db5045109df8b6dc61c66805cd3a3189c93dafee",
      "sizeBytes": 1975
    },
    {
      "path": "data/profiles/key-players/historical/tajikistan/shukhrat-dzhaborov.json",
      "recordCount": 1,
      "sha256": "e21f2f592c2493e1b94efe4598bbab1097b4b37059c3b74316ff6cbcffb8b5c1",
      "sizeBytes": 1834
    },
    {
      "path": "data/profiles/key-players/historical/tajikistan/sukhrob-hamidov.json",
      "recordCount": 1,
      "sha256": "090b7eee1a75e532090843fc0c39ce65e7ae022f086631ba270ebe3eb1554400",
      "sizeBytes": 1822
    },
    {
      "path": "data/profiles/key-players/historical/tajikistan/tokhirjon-muminov.json",
      "recordCount": 1,
      "sha256": "f5d35125741bdadd0dc348e4a4a477f947d2be4e174c69ccbf0e9ba6393ab88a",
      "sizeBytes": 2117
    },
    {
      "path": "data/profiles/key-players/historical/tanzania/amri-kiemba.json",
      "recordCount": 1,
      "sha256": "c25864ae2b43704da09ec5351dbe8efae3dfcf994f92c021f0a5599a23fb0339",
      "sizeBytes": 1573
    },
    {
      "path": "data/profiles/key-players/historical/tanzania/charles-m-mombwa.json",
      "recordCount": 1,
      "sha256": "0aa4767803309c25600709615315d3bbf5d0863df442dc7fce27d60bb329ddba",
      "sizeBytes": 1938
    },
    {
      "path": "data/profiles/key-players/historical/tanzania/danny-mrwanda.json",
      "recordCount": 1,
      "sha256": "af1e4eadf2eed6e30450756bc20fc80cae201b41450341e22c6bf1ce78e71722",
      "sizeBytes": 1630
    },
    {
      "path": "data/profiles/key-players/historical/tanzania/erasto-nyoni.json",
      "recordCount": 1,